"","kegg.name","id","grpvar","EMO","MEM","MMO","KO","names","Pathway","Bamboo","Larval food","BvL","sBvL","food_indicator"
"119","K08977_bisanhydrobacterioruberin hydratase [EC:4.2.1.161]","K08977","variable:Microbe_treatment",0.447453123167325,0.203998504890776,-0.974639480534189,"K08977","bisanhydrobacterioruberin hydratase [EC:4.2.1.161]","Not Included in Pathway or Brite; Unclassified: metabolism; Enzymes with EC numbers",0.873421093975401,-1.06964738740946,1.94306848138486,2.68383866149099,"Bamboo"
"120","K09123_cis-L-3-hydroxyproline dehydratase [EC:4.2.1.171]","K09123","variable:Microbe_treatment",0.617335230509477,0.693612505377008,-1.40056313005763,"K09123","cis-L-3-hydroxyproline dehydratase [EC:4.2.1.171]","Metabolism; Amino acid metabolism; Arginine and proline metabolism",0.668217911346812,-0.722628671213279,1.39084658256009,1.91999235042954,"Bamboo"
"121","K09128_uncharacterized protein","K09128","variable:Microbe_treatment",0.394791344602585,0.510078974936051,-1.0651042610597,"K09128","uncharacterized protein","Not Included in Pathway or Brite; Poorly characterized; Function unknown",0.489700900057888,-0.586988320318633,1.07668922037652,1.48544250242929,"Bamboo"
"122","K09154_uncharacterized protein","K09154","variable:Microbe_treatment",0.130492604830979,0.281553418687522,-0.758359460733088,"K09154","uncharacterized protein","Not Included in Pathway or Brite; Poorly characterized; Function unknown",0.529878527366163,-0.740145719125965,1.27002424649213,1.7528680551132,"Bamboo"
"123","K09512_DnaJ homolog subfamily B member 6","K09512","variable:Microbe_treatment",0.333590789369466,0.104471464862183,-0.834737244772103,"K09512","DnaJ homolog subfamily B member 6","Brite Hierarchies; Protein families: genetic information processing; Chaperones and folding catalysts",0.445699881157212,-0.68654452459103,1.13224440574824,1.5622877407236,"Bamboo"
"124","K09523_DnaJ homolog subfamily C member 3","K09523","variable:Microbe_treatment",0.63461655916077,0.249678792970352,-1.19802065193626,"K09523","DnaJ homolog subfamily C member 3","Genetic Information Processing; Folding, sorting and degradation; Protein processing in endoplasmic reticulum | Human Diseases; Infectious diseases: Viral; Influenza A | Brite Hierarchies; Protein families: genetic information processing; Chaperones and folding catalysts",0.482303840365364,-0.672784863292443,1.15508870365781,1.59388651057344,"Bamboo"
"125","K09560_suppressor of tumorigenicity protein 13","K09560","variable:Microbe_treatment",-0.125487734377997,0.202211513303185,-0.484131688687962,"K09560","suppressor of tumorigenicity protein 13","Brite Hierarchies; Protein families: genetic information processing; Chaperones and folding catalysts | Brite Hierarchies; Protein families: genetic information processing; Membrane trafficking",0.37672300398942,-0.624084231943935,1.00080723593335,1.38048075785471,"Bamboo"
"126","K09700_uncharacterized protein","K09700","variable:Microbe_treatment",0.151333741067945,0.310811667392144,-0.767676002179563,"K09700","uncharacterized protein","Not Included in Pathway or Brite; Poorly characterized; Function unknown",0.645966844954903,-0.831472381369569,1.47743922632447,2.03976933074352,"Bamboo"
"127","K09769_uncharacterized protein","K09769","variable:Microbe_treatment",-0.016794196703094,0.0494381069647484,-0.15728896359027,"K09769","uncharacterized protein","Not Included in Pathway or Brite; Poorly characterized; Function unknown",0.472116599380118,-0.547795919076625,1.01991251845674,1.40690763373257,"Bamboo"
"128","K09778_Kdo2-lipid IVA 3' secondary acyltransferase","K09778","variable:Microbe_treatment",0.113734457187676,0.279792799905806,-0.638848637256796,"K09778","Kdo2-lipid IVA 3' secondary acyltransferase","Brite Hierarchies; Protein families: metabolism; Lipopolysaccharide biosynthesis proteins",0.662885873806647,-0.81183486666255,1.4747207404692,2.03600905720738,"Bamboo"
"129","K09859_uncharacterized protein","K09859","variable:Microbe_treatment",0.315701038525985,0.195660075433684,-0.602391309421112,"K09859","uncharacterized protein","Not Included in Pathway or Brite; Poorly characterized; Function unknown",0.721004759319824,-0.776274527998084,1.49727928731791,2.06721256947295,"Bamboo"
"130","K09992_uncharacterized protein","K09992","variable:Microbe_treatment",0.691584536975424,0.64588605091469,-1.25858458594891,"K09992","uncharacterized protein","Not Included in Pathway or Brite; Poorly characterized; Function unknown",0.788641915505898,-0.740745598716268,1.52938751422217,2.1116254236675,"Bamboo"
"131","K10046_GDP-D-mannose 3', 5'-epimerase [EC:5.1.3.18 5.1.3.-]","K10046","variable:Microbe_treatment",0.323633178974175,0.258943056007081,-0.903630178995885,"K10046","GDP-D-mannose 3', 5'-epimerase [EC:5.1.3.18 5.1.3.-]","Metabolism; Carbohydrate metabolism; Ascorbate and aldarate metabolism | Metabolism; Carbohydrate metabolism; Amino sugar and nucleotide sugar metabolism",0.7243771928525,-0.919307865350592,1.64368505820309,2.26972447319635,"Bamboo"
"132","K10106_vitamin K-dependent gamma-carboxylase [EC:4.1.1.90]","K10106","variable:Microbe_treatment",-0.350691862363989,0.245048552083904,-0.0854778687545853,"K10106","vitamin K-dependent gamma-carboxylase [EC:4.1.1.90]","Metabolism; Metabolism of cofactors and vitamins; Ubiquinone and other terpenoid-quinone biosynthesis",1.40155195458486,-1.51759282762942,2.91914478221428,4.03397034458753,"Bamboo"
"133","K10253_DOPA 4,5-dioxygenase [EC:1.14.99.-]","K10253","variable:Microbe_treatment",0.394380079531281,0.422036162629692,-0.916404004799765,"K10253","DOPA 4,5-dioxygenase [EC:1.14.99.-]","Not Included in Pathway or Brite; Unclassified: metabolism; Enzymes with EC numbers",0.67306339372829,-0.733771826613546,1.40683522034184,1.94210821004046,"Bamboo"
"134","K10530_L-lactate oxidase [EC:1.1.3.2]","K10530","variable:Microbe_treatment",0.733056254854254,0.486876962654756,-1.39950356740018,"K10530","L-lactate oxidase [EC:1.1.3.2]","Not Included in Pathway or Brite; Unclassified: metabolism; Enzymes with EC numbers",0.640446317882039,-0.749474005339471,1.38992032322151,1.91871112673963,"Bamboo"
"135","K10533_limonene-1,2-epoxide hydrolase [EC:3.3.2.8]","K10533","variable:Microbe_treatment",0.452449028493912,0.272682991914598,-1.07299277990217,"K10533","limonene-1,2-epoxide hydrolase [EC:3.3.2.8]","Metabolism; Metabolism of terpenoids and polyketides; Limonene and pinene degradation",0.584494349488786,-0.795701011322243,1.38019536081103,1.9052593301371,"Bamboo"
"136","K10622_HCOMODA/2-hydroxy-3-carboxy-muconic semialdehyde decarboxylase [EC:4.1.1.-]","K10622","variable:Microbe_treatment",0.319526300501884,0.161818693235106,-0.765015201294244,"K10622","HCOMODA/2-hydroxy-3-carboxy-muconic semialdehyde decarboxylase [EC:4.1.1.-]","Metabolism; Xenobiotics biodegradation and metabolism; Benzoate degradation | Metabolism; Xenobiotics biodegradation and metabolism; Xylene degradation",0.933176882327709,-1.10540969664968,2.03858657897739,2.81596153934305,"Bamboo"
"137","K10710_fructoselysine 6-kinase [EC:2.7.1.218]","K10710","variable:Microbe_treatment",-0.493108244047628,0.170276036163848,0.103520649105717,"K10710","fructoselysine 6-kinase [EC:2.7.1.218]","Not Included in Pathway or Brite; Unclassified: metabolism; Enzymes with EC numbers",0.625144355452934,-0.758301260814809,1.38344561626774,1.90975515988579,"Bamboo"
"138","K10714_methylene-tetrahydromethanopterin dehydrogenase [EC:1.5.1.-]","K10714","variable:Microbe_treatment",0.237715041945648,0.151852447509344,-0.745618195055429,"K10714","methylene-tetrahydromethanopterin dehydrogenase [EC:1.5.1.-]","Metabolism; Energy metabolism; Methane metabolism",0.655881844664497,-0.872061102948115,1.52794294761261,2.10962726517698,"Bamboo"
"139","K10799_tankyrase [EC:2.4.2.30]","K10799","variable:Microbe_treatment",0.342765705021759,0.372469007958787,-1.02584552983035,"K10799","tankyrase [EC:2.4.2.30]","Brite Hierarchies; Protein families: genetic information processing; DNA replication proteins | Brite Hierarchies; Protein families: genetic information processing; Chromosome and associated proteins",0.760760485770633,-0.949350523496363,1.710111009267,2.36160641012586,"Bamboo"
"140","K10819_histidine kinase [EC:2.7.13.3]","K10819","variable:Microbe_treatment",0.392374082567048,0.642784786890987,-0.83766290066745,"K10819","histidine kinase [EC:2.7.13.3]","Not Included in Pathway or Brite; Unclassified: metabolism; Enzymes with EC numbers",0.567451581606094,-0.447540199952871,1.01499178155897,1.40010115478802,"Bamboo"
"141","K11080_mannopine transport system ATP-binding protein","K11080","variable:Microbe_treatment",0.0713344683681177,0.310674762278303,-0.789019850487239,"K11080","mannopine transport system ATP-binding protein","Environmental Information Processing; Membrane transport; ABC transporters | Brite Hierarchies; Protein families: signaling and cellular processes; Transporters",0.416561432479558,-0.663681442429724,1.08024287490928,1.49035800091172,"Bamboo"
"142","K11127_telomerase protein component 1","K11127","variable:Microbe_treatment",0.635813843059596,0.23074149183886,-1.10084986724294,"K11127","telomerase protein component 1","Brite Hierarchies; Protein families: genetic information processing; DNA replication proteins",0.619053464860078,-0.761307411911592,1.38036087677167,1.9054882757045,"Bamboo"
"143","K11159_carotenoid cleavage dioxygenase","K11159","variable:Microbe_treatment",0.236519085092386,0.344752891022327,-0.429383665383249,"K11159","carotenoid cleavage dioxygenase","Not Included in Pathway or Brite; Unclassified: metabolism; Secondary metabolism",0.53864956563723,-0.446429267125232,0.985078832762462,1.35872486087463,"Bamboo"
"144","K11165_dehydrogenase/reductase SDR family member 7 [EC:1.1.-.-]","K11165","variable:Microbe_treatment",0.26685399639519,0.398582958501947,-0.75394653158955,"K11165","dehydrogenase/reductase SDR family member 7 [EC:1.1.-.-]","Not Included in Pathway or Brite; Unclassified: metabolism; Enzymes with EC numbers",0.577527380929773,-0.631266734171879,1.20879411510165,1.66817309808966,"Bamboo"
"145","K11212_LPPG:FO 2-phospho-L-lactate transferase [EC:2.7.8.28]","K11212","variable:Microbe_treatment",0.326827861602076,0.449806813856878,-0.85786876014327,"K11212","LPPG:FO 2-phospho-L-lactate transferase [EC:2.7.8.28]","Metabolism; Energy metabolism; Methane metabolism",0.556968439335796,-0.606290414824623,1.16325885416042,1.60518765479738,"Bamboo"
"146","K11333_3,8-divinyl chlorophyllide a/chlorophyllide a reductase subunit X [EC:1.3.7.14 1.3.7.15]","K11333","variable:Microbe_treatment",0.142032323567632,0.248540538312962,-0.803118455111831,"K11333","3,8-divinyl chlorophyllide a/chlorophyllide a reductase subunit X [EC:1.3.7.14 1.3.7.15]","Metabolism; Metabolism of cofactors and vitamins; Porphyrin and chlorophyll metabolism",0.566704129428914,-0.81718474623462,1.38388887566353,1.91036828670137,"Bamboo"
"147","K11334_3,8-divinyl chlorophyllide a/chlorophyllide a reductase subunit Y [EC:1.3.7.14 1.3.7.15]","K11334","variable:Microbe_treatment",0.562267840246777,0.0721685696564515,-1.00171659880848,"K11334","3,8-divinyl chlorophyllide a/chlorophyllide a reductase subunit Y [EC:1.3.7.14 1.3.7.15]","Metabolism; Metabolism of cofactors and vitamins; Porphyrin and chlorophyll metabolism",0.62630369042875,-0.849301026400627,1.47560471682938,2.03723179408766,"Bamboo"
"148","K11336_3-vinyl bacteriochlorophyllide hydratase [EC:4.2.1.165]","K11336","variable:Microbe_treatment",0.108644699035944,0.225352277922292,-0.755980964039027,"K11336","3-vinyl bacteriochlorophyllide hydratase [EC:4.2.1.165]","Metabolism; Metabolism of cofactors and vitamins; Porphyrin and chlorophyll metabolism",0.518015339212202,-0.774226558288009,1.29224189750021,1.78360003223887,"Bamboo"
"149","K11337_bacteriochlorophyllide a dehydrogenase [EC:1.1.1.396]","K11337","variable:Microbe_treatment",0.375782562756386,0.173868582283263,-0.937802429269892,"K11337","bacteriochlorophyllide a dehydrogenase [EC:1.1.1.396]","Metabolism; Metabolism of cofactors and vitamins; Porphyrin and chlorophyll metabolism",0.700599426522747,-0.936268828118857,1.6368682546416,2.26029531027334,"Bamboo"
"150","K11584_serine/threonine-protein phosphatase 2A regulatory subunit B'","K11584","variable:Microbe_treatment",0.624320644231951,0.40805541712467,-1.35161418669924,"K11584","serine/threonine-protein phosphatase 2A regulatory subunit B'","Genetic Information Processing; Translation; mRNA surveillance pathway | Environmental Information Processing; Signal transduction; Sphingolipid signaling pathway | Environmental Information Processing; Signal transduction; PI3K-Akt signaling pathway | Environmental Information Processing; Signal transduction; AMPK signaling pathway | Cellular Processes; Cell growth and death; Meiosis - yeast | Cellular Processes; Cell growth and death; Oocyte meiosis | Organismal Systems; Circulatory system; Adrenergic signaling in cardiomyocytes | Organismal Systems; Nervous system; Dopaminergic synapse | Human Diseases; Infectious diseases: Viral; Human papillomavirus infection | Brite Hierarchies; Protein families: metabolism; Protein phosphatases and associated proteins | Brite Hierarchies; Protein families: genetic information processing; Chromosome and associated proteins",0.973990437316872,-1.16781861983947,2.14180905715634,2.95874129752253,"Bamboo"
"151","K11617_two-component system, NarL family, sensor histidine kinase LiaS [EC:2.7.13.3]","K11617","variable:Microbe_treatment",0.61871264224207,0.070396472472543,-0.742766849349327,"K11617","two-component system, NarL family, sensor histidine kinase LiaS [EC:2.7.13.3]","Environmental Information Processing; Signal transduction; Two-component system | Brite Hierarchies; Protein families: metabolism; Protein kinases | Brite Hierarchies; Protein families: signaling and cellular processes; Two-component system",0.490123317510896,-0.522702074109483,1.01282539162038,1.39710455330149,"Bamboo"
"152","K11725_phospholysine phosphohistidine inorganic pyrophosphate phosphatase [EC:3.6.1.1 3.1.3.-]","K11725","variable:Microbe_treatment",-0.0532017165618173,0.516000582567955,-0.685618659017959,"K11725","phospholysine phosphohistidine inorganic pyrophosphate phosphatase [EC:3.6.1.1 3.1.3.-]","Metabolism; Energy metabolism; Oxidative phosphorylation | Brite Hierarchies; Protein families: metabolism; Protein phosphatases and associated proteins",1.05262198376248,-1.1879089438121,2.24053092757458,3.09529570925547,"Bamboo"
"153","K11779_FO synthase [EC:2.5.1.147 4.3.1.32]","K11779","variable:Microbe_treatment",0.785694514665003,0.95484163919385,-1.80114008262986,"K11779","FO synthase [EC:2.5.1.147 4.3.1.32]","Metabolism; Energy metabolism; Methane metabolism",0.67951954804228,-0.716315746349755,1.39583529439203,1.92689285390086,"Bamboo"
"154","K11899_type VI secretion system protein ImpD","K11899","variable:Microbe_treatment",-0.022493047804435,0.256618231742492,-0.607167440287777,"K11899","type VI secretion system protein ImpD","Brite Hierarchies; Protein families: signaling and cellular processes; Secretion system",0.73246341141181,-0.958959236353748,1.69142264776556,2.33575622920577,"Bamboo"
"155","K11915_serine/threonine protein phosphatase Stp1 [EC:3.1.3.16]","K11915","variable:Microbe_treatment",0.030587905280704,0.0966181554620356,-0.379578343229277,"K11915","serine/threonine protein phosphatase Stp1 [EC:3.1.3.16]","Environmental Information Processing; Membrane transport; Bacterial secretion system | Cellular Processes; Cellular community - prokaryotes; Biofilm formation - Pseudomonas aeruginosa | Brite Hierarchies; Protein families: signaling and cellular processes; Secretion system",0.619780477085529,-0.773010486129546,1.39279096321508,1.92268186345641,"Bamboo"
"156","K11918_type VI secretion system protein","K11918","variable:Microbe_treatment",0.461527315975982,0.333692693557098,-1.13425494905332,"K11918","type VI secretion system protein","Brite Hierarchies; Protein families: signaling and cellular processes; Secretion system",0.654379926364937,-0.860227915443115,1.51460784180805,2.0911818333712,"Bamboo"
"157","K11997_tripartite motif-containing protein 2/3","K11997","variable:Microbe_treatment",0.365515192719658,0.130506341487209,-0.882494548899933,"K11997","tripartite motif-containing protein 2/3","Brite Hierarchies; Protein families: genetic information processing; Ubiquitin system",0.47870662469832,-0.713357050463066,1.19206367516139,1.64503116029617,"Bamboo"
"158","K12056_conjugal transfer mating pair stabilization protein TraG","K12056","variable:Microbe_treatment",0.111137091368595,0.40947928052354,-0.42348724688401,"K12056","conjugal transfer mating pair stabilization protein TraG","Brite Hierarchies; Protein families: signaling and cellular processes; Secretion system",0.693710908894584,-0.634738122514105,1.32844903140869,1.83368259095115,"Bamboo"
"159","K12057_conjugal transfer pilus assembly protein TraF","K12057","variable:Microbe_treatment",0.296344757999699,0.438382356519359,-0.761937156465343,"K12057","conjugal transfer pilus assembly protein TraF","Brite Hierarchies; Protein families: signaling and cellular processes; Secretion system",0.534397674893427,-0.550918486657848,1.08531616155128,1.49737549024832,"Bamboo"
"160","K12058_conjugal transfer mating pair stabilization protein TraN","K12058","variable:Microbe_treatment",0.2581518483759,0.254896103571884,-0.518453537642073,"K12058","conjugal transfer mating pair stabilization protein TraN","Brite Hierarchies; Protein families: signaling and cellular processes; Secretion system",0.60388692249875,-0.607168970498091,1.21105589299684,1.67130164243996,"Bamboo"
"161","K12059_conjugal transfer pilus assembly protein TrbC","K12059","variable:Microbe_treatment",0.0784836495854193,0.232954353464242,-0.423250427800754,"K12059","conjugal transfer pilus assembly protein TrbC","Brite Hierarchies; Protein families: signaling and cellular processes; Secretion system",1.15537083552558,-1.22325871404789,2.37862954957347,3.28631696937031,"Bamboo"
"162","K12060_conjugal transfer pilus assembly protein TraU","K12060","variable:Microbe_treatment",0.228465143014719,0.422477157586156,-0.67087067842322,"K12060","conjugal transfer pilus assembly protein TraU","Brite Hierarchies; Protein families: signaling and cellular processes; Secretion system",0.649279060985369,-0.661378747543116,1.31065780852849,1.80907335326022,"Bamboo"
"163","K12061_conjugal transfer pilus assembly protein TraW","K12061","variable:Microbe_treatment",0.214162566581151,0.384560925769372,-0.64610270763759,"K12061","conjugal transfer pilus assembly protein TraW","Brite Hierarchies; Protein families: signaling and cellular processes; Secretion system",0.556703975335888,-0.585470674734912,1.1421746500708,1.5760234880923,"Bamboo"
"164","K12063_conjugal transfer ATP-binding protein TraC","K12063","variable:Microbe_treatment",0.249238665863231,0.482008838863421,-0.689439429816301,"K12063","conjugal transfer ATP-binding protein TraC","Brite Hierarchies; Protein families: signaling and cellular processes; Secretion system",0.979223918622366,-0.953839785176698,1.93306370379906,2.66999981796058,"Bamboo"
"165","K12064_conjugal transfer pilus assembly protein TraV","K12064","variable:Microbe_treatment",0.306299780203934,0.349572702238228,-0.728555764176676,"K12064","conjugal transfer pilus assembly protein TraV","Brite Hierarchies; Protein families: signaling and cellular processes; Secretion system",0.849253792110208,-0.89338407380278,1.74263786591299,2.40659832281955,"Bamboo"
"166","K12065_conjugal transfer pilus assembly protein TraB","K12065","variable:Microbe_treatment",0.293367848648034,0.576912187502811,-0.852280926017972,"K12065","conjugal transfer pilus assembly protein TraB","Brite Hierarchies; Protein families: signaling and cellular processes; Secretion system",0.781833185170927,-0.770904870138583,1.55273805530951,2.14392444098068,"Bamboo"
"167","K12066_conjugal transfer pilus assembly protein TraK","K12066","variable:Microbe_treatment",0.300565652763161,0.44096370670202,-0.76785984473846,"K12066","conjugal transfer pilus assembly protein TraK","Brite Hierarchies; Protein families: signaling and cellular processes; Secretion system",0.635487680727357,-0.651474462068026,1.28696214279538,1.77629695142448,"Bamboo"
"168","K12067_conjugal transfer pilus assembly protein TraE","K12067","variable:Microbe_treatment",0.261812637090861,0.434896509192432,-0.734287341221099,"K12067","conjugal transfer pilus assembly protein TraE","Brite Hierarchies; Protein families: signaling and cellular processes; Secretion system",0.60805330449024,-0.630869229810743,1.23892253430098,1.70984743572911,"Bamboo"
"169","K12072_conjugative transfer pilus assembly protein TraH","K12072","variable:Microbe_treatment",0.24793142048274,0.425747991460332,-0.678196215535942,"K12072","conjugative transfer pilus assembly protein TraH","Brite Hierarchies; Protein families: signaling and cellular processes; Secretion system",0.772377762065153,-0.775120178342275,1.54749794040743,2.13667619087323,"Bamboo"
"170","K12111_evolved beta-galactosidase subunit alpha [EC:3.2.1.23]","K12111","variable:Microbe_treatment",-0.146814766600203,0.694204673184904,-0.650627262674262,"K12111","evolved beta-galactosidase subunit alpha [EC:3.2.1.23]","Metabolism; Carbohydrate metabolism; Galactose metabolism | Metabolism; Glycan biosynthesis and metabolism; Other glycan degradation",0.930998292361143,-0.99367974395093,1.92467803631207,2.65840056557787,"Bamboo"
"171","K12129_pseudo-response regulator 7","K12129","variable:Microbe_treatment",0.418661094898925,0.273542514433226,-1.03615786424936,"K12129","pseudo-response regulator 7","Organismal Systems; Environmental adaptation; Circadian rhythm - plant",0.375250558566446,-0.5840853524369,0.959335911003346,1.32311664638062,"Bamboo"
"172","K12234_coenzyme F420-0:L-glutamate ligase / coenzyme F420-1:gamma-L-glutamate ligase [EC:6.3.2.31 6.3.2.34]","K12234","variable:Microbe_treatment",0.582731357860487,0.679721635800409,-1.39458172569442,"K12234","coenzyme F420-0:L-glutamate ligase / coenzyme F420-1:gamma-L-glutamate ligase [EC:6.3.2.31 6.3.2.34]","Metabolism; Energy metabolism; Methane metabolism",0.537716684421762,-0.617939784220971,1.15565646864273,1.59467185644656,"Bamboo"
"173","K12286_MSHA biogenesis protein MshP","K12286","variable:Microbe_treatment",0.212489225338948,0.0392823149868561,-0.442147109619383,"K12286","MSHA biogenesis protein MshP","Brite Hierarchies; Protein families: signaling and cellular processes; Secretion system",0.452610682942495,-0.568198852598848,1.02080953554134,1.4081484088494,"Bamboo"
"174","K12309_beta-galactosidase [EC:3.2.1.23]","K12309","variable:Microbe_treatment",0.868055482245311,1.00659663350367,-2.11223798850675,"K12309","beta-galactosidase [EC:3.2.1.23]","Metabolism; Carbohydrate metabolism; Galactose metabolism | Metabolism; Lipid metabolism; Sphingolipid metabolism | Metabolism; Glycan biosynthesis and metabolism; Glycosaminoglycan degradation | Metabolism; Glycan biosynthesis and metabolism; Glycosphingolipid biosynthesis - ganglio series | Metabolism; Glycan biosynthesis and metabolism; Other glycan degradation | Cellular Processes; Transport and catabolism; Lysosome | Brite Hierarchies; Protein families: signaling and cellular processes; Exosome",1.57736999138961,-1.72162230417418,3.29899229556378,4.5593843538026,"Bamboo"
"175","K12533_ATP-binding cassette, subfamily C, bacterial RsaD","K12533","variable:Microbe_treatment",0.387942067281022,0.0981169378989124,-0.875869722031953,"K12533","ATP-binding cassette, subfamily C, bacterial RsaD","Environmental Information Processing; Membrane transport; ABC transporters | Brite Hierarchies; Protein families: signaling and cellular processes; Transporters | Brite Hierarchies; Protein families: signaling and cellular processes; Secretion system",0.505988705801111,-0.742665646232855,1.24865435203397,1.72330871477487,"Bamboo"
"176","K12982_heptosyltransferase I [EC:2.4.-.-]","K12982","variable:Microbe_treatment",0.0727346140936079,0.351379954333142,-0.645187424731207,"K12982","heptosyltransferase I [EC:2.4.-.-]","Brite Hierarchies; Protein families: metabolism; Glycosyltransferases | Brite Hierarchies; Protein families: metabolism; Lipopolysaccharide biosynthesis proteins",0.427353712872698,-0.561580005226042,0.98893371809874,1.36405702888526,"Bamboo"
"177","K12996_rhamnosyltransferase [EC:2.4.1.-]","K12996","variable:Microbe_treatment",0.0161233343388866,0.0405096833541478,-0.0588233128689666,"K12996","rhamnosyltransferase [EC:2.4.1.-]","Brite Hierarchies; Protein families: metabolism; Glycosyltransferases | Brite Hierarchies; Protein families: metabolism; Lipopolysaccharide biosynthesis proteins",0.703836577459655,-0.705166434075882,1.40900301153554,1.945106749776,"Bamboo"
"178","K13107_RNA-binding motif protein, X-linked 2","K13107","variable:Microbe_treatment",0.270610568554724,0.24362471679292,-0.87054064481514,"K13107","RNA-binding motif protein, X-linked 2","Brite Hierarchies; Protein families: genetic information processing; Spliceosome",0.848622018179855,-1.06495589175628,1.91357790993613,2.64304660985351,"Bamboo"
"179","K13126_polyadenylate-binding protein","K13126","variable:Microbe_treatment",0.0291108584586896,0.0562051192139668,-0.270739115522547,"K13126","polyadenylate-binding protein","Genetic Information Processing; Translation; RNA transport | Genetic Information Processing; Translation; mRNA surveillance pathway | Genetic Information Processing; Folding, sorting and degradation; RNA degradation | Brite Hierarchies; Protein families: genetic information processing; Messenger RNA biogenesis | Brite Hierarchies; Protein families: genetic information processing; Spliceosome",0.706075615128897,-0.818656873299451,1.52473248842835,2.10518648256779,"Bamboo"
