"","kegg.name","id","grpvar","EMO","MEM","MMO","KO","names","Pathway","Bamboo","Larval food","BvL","sBvL","food_indicator"
"429","K06295_spore germination protein KA","K06295","variable:Microbe_treatment",-1.72105703541475,0.618860609579707,0.857267700991239,"K06295","spore germination protein KA","Not Included in Pathway or Brite; Unclassified: signaling and cellular processes; Cell growth",-0.82840181025584,0.679691221465421,-1.50809303172126,-2.08988906693408,"Standard"
"430","K06331_spore coat protein I","K06331","variable:Microbe_treatment",-1.07762981259686,0.277752659509194,0.426170242505494,"K06331","spore coat protein I","Not Included in Pathway or Brite; Unclassified: signaling and cellular processes; Cell growth",-0.873792289924578,0.646892914430076,-1.52068520435465,-2.10730685611401,"Standard"
"431","K06333_spore coat protein JB","K06333","variable:Microbe_treatment",-0.910102627122508,0.2391494720803,0.280006746803372,"K06333","spore coat protein JB","Not Included in Pathway or Brite; Unclassified: signaling and cellular processes; Cell growth",-0.59062030676563,0.353253821508445,-0.943874128274075,-1.3094482170756,"Standard"
"432","K06334_spore coat protein JC","K06334","variable:Microbe_treatment",-0.970140876086198,0.325776930220411,0.264697712553898,"K06334","spore coat protein JC","Not Included in Pathway or Brite; Unclassified: signaling and cellular processes; Cell growth",-0.632632925187662,0.402115295474533,-1.0347482206622,-1.43514739776628,"Standard"
"433","K06337_spore coat-associated protein S","K06337","variable:Microbe_treatment",-0.835244008989141,0.265064002841854,0.155134838311668,"K06337","spore coat-associated protein S","Not Included in Pathway or Brite; Unclassified: signaling and cellular processes; Cell growth",-0.679941675098442,0.427943420002739,-1.10788509510118,-1.53631204165613,"Standard"
"434","K06382_stage II sporulation protein E [EC:3.1.3.16]","K06382","variable:Microbe_treatment",-1.26244416420902,0.210829278090006,0.736456542884127,"K06382","stage II sporulation protein E [EC:3.1.3.16]","Not Included in Pathway or Brite; Unclassified: metabolism; Enzymes with EC numbers",-0.60719547646347,0.415844368852217,-1.02303984531569,-1.41895209776824,"Standard"
"435","K06383_stage II sporulation protein GA (sporulation sigma-E factor processing peptidase) [EC:3.4.23.-]","K06383","variable:Microbe_treatment",-1.07719366330543,0.161861914689802,0.562664925442034,"K06383","stage II sporulation protein GA (sporulation sigma-E factor processing peptidase) [EC:3.4.23.-]","Brite Hierarchies; Protein families: metabolism; Peptidases",-0.585869154574697,0.371744449706217,-0.957613604280914,-1.32845298325035,"Standard"
"436","K06385_stage II sporulation protein P","K06385","variable:Microbe_treatment",-0.834974135176694,0.152821226519615,0.409541042637597,"K06385","stage II sporulation protein P","Not Included in Pathway or Brite; Unclassified: signaling and cellular processes; Cell growth",-0.570503749960436,0.404985103126071,-0.975488853086507,-1.35317844757641,"Standard"
"437","K06396_stage III sporulation protein AG","K06396","variable:Microbe_treatment",-0.827950960981268,0.147441836976676,0.325261687266696,"K06396","stage III sporulation protein AG","Not Included in Pathway or Brite; Unclassified: signaling and cellular processes; Cell growth",-0.709128278329211,0.493436731666929,-1.20256500999614,-1.66727552549847,"Standard"
"438","K06397_stage III sporulation protein AH","K06397","variable:Microbe_treatment",-0.972794239263133,0.371977261630187,0.221844455480056,"K06397","stage III sporulation protein AH","Not Included in Pathway or Brite; Unclassified: signaling and cellular processes; Cell growth",-0.631358469534038,0.401262032537163,-1.0326205020712,-1.43220428739676,"Standard"
"439","K06405_stage V sporulation protein AC","K06405","variable:Microbe_treatment",-1.09595036471447,0.220978856388626,0.52352430603271,"K06405","stage V sporulation protein AC","Not Included in Pathway or Brite; Unclassified: signaling and cellular processes; Cell growth",-0.62940188836018,0.416017686833435,-1.04541957519362,-1.44990826619653,"Standard"
"440","K06406_stage V sporulation protein AD","K06406","variable:Microbe_treatment",-1.25999633261988,0.249747855529444,0.694185828416118,"K06406","stage V sporulation protein AD","Not Included in Pathway or Brite; Unclassified: signaling and cellular processes; Cell growth",-0.613328820428743,0.421428655966646,-1.03475747639539,-1.435160200514,"Standard"
"441","K06407_stage V sporulation protein AE","K06407","variable:Microbe_treatment",-0.95031447445933,0.200591761467344,0.417122913333747,"K06407","stage V sporulation protein AE","Not Included in Pathway or Brite; Unclassified: signaling and cellular processes; Cell growth",-0.685930837740897,0.483989999359055,-1.16992083709995,-1.62212133820986,"Standard"
"442","K06409_stage V sporulation protein B","K06409","variable:Microbe_treatment",-0.573341383039138,0.0200359577325062,0.336878893481364,"K06409","stage V sporulation protein B","Brite Hierarchies; Protein families: signaling and cellular processes; Transporters",-1.03239852211002,0.900993285757566,-1.93339180786758,-2.67817233123361,"Standard"
"443","K06421_small acid-soluble spore protein D (minor alpha/beta-type SASP)","K06421","variable:Microbe_treatment",-1.21047527764673,0.220632317556779,0.664711354782245,"K06421","small acid-soluble spore protein D (minor alpha/beta-type SASP)","Not Included in Pathway or Brite; Unclassified: signaling and cellular processes; Cell growth",-0.597239332614126,0.399832872875612,-0.997072205489738,-1.38303304796193,"Standard"
"444","K06436_spore coat assemly protein","K06436","variable:Microbe_treatment",-1.06097762341925,0.25554207959127,0.441084937200472,"K06436","spore coat assemly protein","Not Included in Pathway or Brite; Unclassified: signaling and cellular processes; Cell growth",-0.705365665473527,0.484147050661086,-1.18951271613461,-1.64922128582012,"Standard"
"445","K06440_similar to spore coat protein","K06440","variable:Microbe_treatment",-0.855996516705815,0.355934290545747,0.0888640674700718,"K06440","similar to spore coat protein","Not Included in Pathway or Brite; Unclassified: signaling and cellular processes; Cell growth",-0.698053565650146,0.448391055353231,-1.14644462100338,-1.58964848426978,"Standard"
"446","K06605_myo-inositol catabolism protein IolH","K06605","variable:Microbe_treatment",-0.253565308883916,-0.319240017663328,0.621258567363551,"K06605","myo-inositol catabolism protein IolH","Not Included in Pathway or Brite; Unclassified: metabolism; Carbohydrate metabolism",-0.50679389869027,0.53621270195719,-1.04300660064746,-1.44657058308456,"Standard"
"447","K06714_arginine utilization regulatory protein","K06714","variable:Microbe_treatment",-0.684035298646075,-0.397404984905958,1.0853771604468,"K06714","arginine utilization regulatory protein","Brite Hierarchies; Protein families: genetic information processing; Transcription factors",-0.533456274058573,0.535846582836726,-1.0693028568953,-1.48294418285014,"Standard"
"448","K06946_uncharacterized protein","K06946","variable:Microbe_treatment",-0.310700336418093,-0.296263054740729,0.691337134001856,"K06946","uncharacterized protein","Not Included in Pathway or Brite; Poorly characterized; Function unknown",-0.464522299864481,0.515750545896632,-0.980272845761113,-1.35979577869714,"Standard"
"449","K06967_tRNA (adenine22-N1)-methyltransferase [EC:2.1.1.217]","K06967","variable:Microbe_treatment",-0.316652646117965,-0.192917129193913,0.250958130731706,"K06967","tRNA (adenine22-N1)-methyltransferase [EC:2.1.1.217]","Brite Hierarchies; Protein families: genetic information processing; Transfer RNA biogenesis",-0.729608083878341,0.572589792299424,-1.30219787617776,-1.80509004798531,"Standard"
"450","K07015_uncharacterized protein","K07015","variable:Microbe_treatment",-0.426930465386911,-0.230420105748942,0.344550831594291,"K07015","uncharacterized protein","Not Included in Pathway or Brite; Poorly characterized; Function unknown",-0.734739734342688,0.544820673316339,-1.27956040765903,-1.77377736941062,"Standard"
"451","K07023_putative hydrolases of HD superfamily","K07023","variable:Microbe_treatment",-0.222131509309653,-0.243258001762895,0.576912915781368,"K07023","putative hydrolases of HD superfamily","Not Included in Pathway or Brite; Poorly characterized; General function prediction only",-0.443418483360836,0.51113088087051,-0.954549364231346,-1.32421445438533,"Standard"
"452","K07050_misacylated tRNA(Ala) deacylase [EC:3.1.1.-]","K07050","variable:Microbe_treatment",-0.33642686491972,-0.312362144281623,0.704734738399341,"K07050","misacylated tRNA(Ala) deacylase [EC:3.1.1.-]","Brite Hierarchies; Protein families: genetic information processing; Transfer RNA biogenesis",-0.588931949432605,0.622899881673502,-1.21183183110611,-1.680093610285,"Standard"
"453","K07067_diadenylate cyclase [EC:2.7.7.85]","K07067","variable:Microbe_treatment",-0.390596756562232,-0.0955248594473954,0.219588368461168,"K07067","diadenylate cyclase [EC:2.7.7.85]","Not Included in Pathway or Brite; Unclassified: metabolism; Enzymes with EC numbers",-0.764200686970951,0.602372725793954,-1.36657341276491,-1.89413580341323,"Standard"
"454","K07099_uncharacterized protein","K07099","variable:Microbe_treatment",-1.03271385743513,0.421909874101227,0.242617012082832,"K07099","uncharacterized protein","Not Included in Pathway or Brite; Poorly characterized; Function unknown",-0.671488891923796,0.447940995225984,-1.11942988714978,-1.55228106939128,"Standard"
"455","K07161_uncharacterized protein","K07161","variable:Microbe_treatment",-0.275349822210344,-0.238867720071669,0.516476174281069,"K07161","uncharacterized protein","Not Included in Pathway or Brite; Poorly characterized; Function unknown",-0.482648496461977,0.484019844370046,-0.966668340832024,-1.34097770768978,"Standard"
"456","K07226_heme iron utilization protein","K07226","variable:Microbe_treatment",-0.23791416753191,-0.216406326897514,0.564476653934317,"K07226","heme iron utilization protein","Not Included in Pathway or Brite; Unclassified: signaling and cellular processes; Others",-0.516403986166016,0.583286248952103,-1.09969023511812,-1.524976718698,"Standard"
"457","K07399_cytochrome c biogenesis protein","K07399","variable:Microbe_treatment",-0.248492663769977,-0.20166327791723,0.636462623502241,"K07399","cytochrome c biogenesis protein","Not Included in Pathway or Brite; Unclassified: genetic information processing; Protein processing",-0.554304015830158,0.66742172534329,-1.22172574117345,-1.69377909925781,"Standard"
"458","K07444_putative N6-adenine-specific DNA methylase [EC:2.1.1.-]","K07444","variable:Microbe_treatment",-0.0646354897660998,-0.12152635423957,0.40707174361404,"K07444","putative N6-adenine-specific DNA methylase [EC:2.1.1.-]","Not Included in Pathway or Brite; Unclassified: metabolism; Enzymes with EC numbers",-0.426109133672744,0.560236485461898,-0.986345619134642,-1.36819578157489,"Standard"
"459","K07518_hydroxybutyrate-dimer hydrolase [EC:3.1.1.22]","K07518","variable:Microbe_treatment",-0.162887368213382,-0.15565376201288,0.360128457628652,"K07518","hydroxybutyrate-dimer hydrolase [EC:3.1.1.22]","Metabolism; Carbohydrate metabolism; Butanoate metabolism",-0.480777675545238,0.506027780236606,-0.986805455781844,-1.36883183843428,"Standard"
"460","K07533_foldase protein PrsA [EC:5.2.1.8]","K07533","variable:Microbe_treatment",-0.617793119603587,-0.224052341167336,0.564243734180777,"K07533","foldase protein PrsA [EC:5.2.1.8]","Brite Hierarchies; Protein families: genetic information processing; Chaperones and folding catalysts",-0.663386288907486,0.494838005169902,-1.15822429407739,-1.60594240496043,"Standard"
"461","K07550_benzoylsuccinyl-CoA thiolase BbsB subunit [EC:2.3.1.-]","K07550","variable:Microbe_treatment",-0.542981220444512,-0.0960807085399156,0.583487354834851,"K07550","benzoylsuccinyl-CoA thiolase BbsB subunit [EC:2.3.1.-]","Metabolism; Xenobiotics biodegradation and metabolism; Toluene degradation",-0.507703058407622,0.473960476157088,-0.98166353456471,-1.36171941214,"Standard"
"462","K07570_general stress protein 13","K07570","variable:Microbe_treatment",-0.0962429482757323,-0.414418720519719,0.120365569157867,"K07570","general stress protein 13","Not Included in Pathway or Brite; Unclassified: genetic information processing; Translation",-0.733841175171382,0.496869530392991,-1.23071070556437,-1.7062073132052,"Standard"
"463","K07571_S1 RNA binding domain protein","K07571","variable:Microbe_treatment",-0.388910259094986,-0.250441785768211,0.381846623006966,"K07571","S1 RNA binding domain protein","Not Included in Pathway or Brite; Unclassified: genetic information processing; Translation",-0.69785894876427,0.541512309857842,-1.23937125862211,-1.71818679377087,"Standard"
"464","K07584_uncharacterized protein","K07584","variable:Microbe_treatment",-0.19414187939627,-0.109575034924484,0.0234971200276723,"K07584","uncharacterized protein","Not Included in Pathway or Brite; Poorly characterized; Function unknown",-0.72408516762926,0.553947301494408,-1.27803246912367,-1.77166388891257,"Standard"
"465","K07650_two-component system, OmpR family, sensor histidine kinase CssS [EC:2.7.13.3]","K07650","variable:Microbe_treatment",-0.367567449438152,-0.164841463073904,0.285369872579759,"K07650","two-component system, OmpR family, sensor histidine kinase CssS [EC:2.7.13.3]","Environmental Information Processing; Signal transduction; Two-component system | Brite Hierarchies; Protein families: metabolism; Protein kinases | Brite Hierarchies; Protein families: signaling and cellular processes; Two-component system",-0.758297140753991,0.608305255947583,-1.36660239670157,-1.89417589467573,"Standard"
"466","K07673_two-component system, NarL family, nitrate/nitrite sensor histidine kinase NarX [EC:2.7.13.3]","K07673","variable:Microbe_treatment",-0.196593180835278,-0.0145407532537836,0.39552946064672,"K07673","two-component system, NarL family, nitrate/nitrite sensor histidine kinase NarX [EC:2.7.13.3]","Environmental Information Processing; Signal transduction; Two-component system | Brite Hierarchies; Protein families: metabolism; Protein kinases | Brite Hierarchies; Protein families: signaling and cellular processes; Two-component system",-0.443254727413784,0.555212062520952,-0.998466789934737,-1.38496206994755,"Standard"
"467","K07679_two-component system, NarL family, sensor histidine kinase EvgS [EC:2.7.13.3]","K07679","variable:Microbe_treatment",-0.371647425471886,-0.371333254479997,1.068961805249,"K07679","two-component system, NarL family, sensor histidine kinase EvgS [EC:2.7.13.3]","Environmental Information Processing; Signal transduction; Two-component system | Human Diseases; Infectious diseases: Bacterial; Pertussis | Brite Hierarchies; Protein families: metabolism; Protein kinases | Brite Hierarchies; Protein families: signaling and cellular processes; Two-component system",-0.408360068493192,0.606282321623827,-1.01464239011702,-1.40733654034566,"Standard"
"468","K07795_putative tricarboxylic transport membrane protein","K07795","variable:Microbe_treatment",-0.117136340729711,-0.0503472058314057,0.602088901364065,"K07795","putative tricarboxylic transport membrane protein","Environmental Information Processing; Signal transduction; Two-component system | Brite Hierarchies; Protein families: signaling and cellular processes; Transporters",-0.449292036665172,0.71316642806386,-1.16245846472903,-1.61179920933481,"Standard"
"469","K07811_trimethylamine-N-oxide reductase (cytochrome c) [EC:1.7.2.3]","K07811","variable:Microbe_treatment",-0.983732260420936,-0.936485920239361,1.86028233661426,"K07811","trimethylamine-N-oxide reductase (cytochrome c) [EC:1.7.2.3]","Metabolism; Energy metabolism; Methane metabolism | Environmental Information Processing; Signal transduction; Two-component system | Brite Hierarchies; Protein families: signaling and cellular processes; Transporters",-0.897427441740709,0.861036876838938,-1.75846431857965,-2.43620851617992,"Standard"
"470","K07814_putative two-component system response regulator","K07814","variable:Microbe_treatment",-0.234485994058712,-0.135812166532624,0.769568087708172,"K07814","putative two-component system response regulator","Brite Hierarchies; Protein families: signaling and cellular processes; Two-component system",-0.433928444467871,0.676348626035868,-1.11027707050374,-1.53962067825906,"Standard"
"471","K08068_UDP-N-acetylglucosamine 2-epimerase (hydrolysing) [EC:3.2.1.183]","K08068","variable:Microbe_treatment",-0.487715666534228,-0.614055949430366,1.10220664930301,"K08068","UDP-N-acetylglucosamine 2-epimerase (hydrolysing) [EC:3.2.1.183]","Metabolism; Carbohydrate metabolism; Amino sugar and nucleotide sugar metabolism",-0.582143303255698,0.582407437501039,-1.16455074075674,-1.61469329471767,"Standard"
"472","K08086_pilus assembly protein FimV","K08086","variable:Microbe_treatment",-0.316564593738317,-0.325001326425865,0.893691902091383,"K08086","pilus assembly protein FimV","Not Included in Pathway or Brite; Unclassified: signaling and cellular processes; Cell motility",-0.487304616883231,0.640385082417308,-1.12768969930054,-1.56370623571454,"Standard"
"473","K08100_bilirubin oxidase [EC:1.3.3.5]","K08100","variable:Microbe_treatment",-0.447309697547665,-0.41446026218941,0.93564495483594,"K08100","bilirubin oxidase [EC:1.3.3.5]","Metabolism; Metabolism of cofactors and vitamins; Porphyrin and chlorophyll metabolism",-0.489369202432544,0.534223043177633,-1.02359224561018,-1.41971619084038,"Standard"
"474","K08152_MFS transporter, DHA1 family, multidrug resistance protein B","K08152","variable:Microbe_treatment",-0.417048530930141,-0.526536661101922,0.642100967835873,"K08152","MFS transporter, DHA1 family, multidrug resistance protein B","Brite Hierarchies; Protein families: signaling and cellular processes; Transporters",-0.81138363208387,0.628334883841579,-1.43971851592545,-1.99531182946416,"Standard"
"475","K08217_MFS transporter, DHA3 family, macrolide efflux protein","K08217","variable:Microbe_treatment",0.0588225160702206,-0.145479445587679,0.144498986822711,"K08217","MFS transporter, DHA3 family, macrolide efflux protein","Brite Hierarchies; Protein families: signaling and cellular processes; Transporters | Brite Hierarchies; Protein families: signaling and cellular processes; Antimicrobial resistance genes",-0.636019541453815,0.671138845668537,-1.30715838712235,-1.81195154332635,"Standard"
"476","K08222_MFS transporter, YQGE family, putative transporter","K08222","variable:Microbe_treatment",-0.503145361038284,0.0982993680746506,0.113798687358712,"K08222","MFS transporter, YQGE family, putative transporter","Brite Hierarchies; Protein families: signaling and cellular processes; Transporters",-0.823307949089109,0.646596066030168,-1.46990401511928,-2.03706512149373,"Standard"
"477","K08352_thiosulfate reductase / polysulfide reductase chain A [EC:1.8.5.5]","K08352","variable:Microbe_treatment",-0.470839377767111,-0.352097411858363,0.84173947613573,"K08352","thiosulfate reductase / polysulfide reductase chain A [EC:1.8.5.5]","Metabolism; Energy metabolism; Sulfur metabolism | Brite Hierarchies; Protein families: signaling and cellular processes; Transporters",-0.596498761307917,0.607914974671887,-1.2044137359798,-1.66983272673549,"Standard"
"478","K08384_stage V sporulation protein D (sporulation-specific penicillin-binding protein)","K08384","variable:Microbe_treatment",-0.449425361991234,0.0959276680467557,0.127361264907033,"K08384","stage V sporulation protein D (sporulation-specific penicillin-binding protein)","Metabolism; Glycan biosynthesis and metabolism; Peptidoglycan biosynthesis | Brite Hierarchies; Protein families: metabolism; Peptidoglycan biosynthesis and degradation proteins",-0.996781005797407,0.859480321565423,-1.85626132736283,-2.57148363755931,"Standard"
"479","K08640_zinc D-Ala-D-Ala carboxypeptidase [EC:3.4.17.14]","K08640","variable:Microbe_treatment",-0.258314949714603,-0.251304625797245,0.26555331362788,"K08640","zinc D-Ala-D-Ala carboxypeptidase [EC:3.4.17.14]","Brite Hierarchies; Protein families: metabolism; Peptidases | Brite Hierarchies; Protein families: metabolism; Peptidoglycan biosynthesis and degradation proteins",-0.56823111060072,0.420044173638597,-0.988275284239317,-1.37086493970666,"Standard"
"480","K08659_dipeptidase [EC:3.4.-.-]","K08659","variable:Microbe_treatment",-0.925282542942967,-0.922676053741769,1.75198926643272,"K08659","dipeptidase [EC:3.4.-.-]","Brite Hierarchies; Protein families: metabolism; Peptidases",-0.815128590888038,0.756859983901651,-1.57198857478969,-2.17827088404412,"Standard"
"481","K08660_cytosolic nonspecific dipeptidase [EC:3.4.13.18]","K08660","variable:Microbe_treatment",-0.653724743477927,-0.662941081038931,1.18782666324687,"K08660","cytosolic nonspecific dipeptidase [EC:3.4.13.18]","Metabolism; Amino acid metabolism; Arginine and proline metabolism | Metabolism; Amino acid metabolism; Histidine metabolism | Metabolism; Metabolism of other amino acids; beta-Alanine metabolism | Brite Hierarchies; Protein families: metabolism; Peptidases | Brite Hierarchies; Protein families: signaling and cellular processes; Exosome",-0.653726109892158,0.575500301367892,-1.22922641126005,-1.70415420243343,"Standard"
"482","K08728_nucleoside deoxyribosyltransferase [EC:2.4.2.6]","K08728","variable:Microbe_treatment",-0.126829910155781,-0.126829579103916,0.195583194378972,"K08728","nucleoside deoxyribosyltransferase [EC:2.4.2.6]","Metabolism; Nucleotide metabolism; Pyrimidine metabolism",-0.49393396359428,0.458672440014363,-0.952606403608642,-1.32152690558049,"Standard"
"483","K08982_putative membrane protein","K08982","variable:Microbe_treatment",-0.960069225050957,0.195388771224769,0.383558014436475,"K08982","putative membrane protein","Not Included in Pathway or Brite; Poorly characterized; General function prediction only",-0.619622973782379,0.388221195983429,-1.00784416976581,-1.39793308215592,"Standard"
"484","K08983_putative membrane protein","K08983","variable:Microbe_treatment",-0.290013901439606,-0.231440834331247,0.479090109996528,"K08983","putative membrane protein","Not Included in Pathway or Brite; Poorly characterized; General function prediction only",-0.52737077475919,0.501648726653956,-1.02901950141315,-1.4272232986409,"Standard"
"485","K08986_putative membrane protein","K08986","variable:Microbe_treatment",-0.389932116274961,-0.11225319010505,0.225738598985112,"K08986","putative membrane protein","Not Included in Pathway or Brite; Poorly characterized; General function prediction only",-0.89254296636815,0.724695962501674,-1.61723892886982,-2.24086223746906,"Standard"
"486","K09008_NADH dehydrogenase [ubiquinone] 1 alpha subcomplex assembly factor 3","K09008","variable:Microbe_treatment",-0.32892941105042,-0.329980581184804,0.674995748156807,"K09008","NADH dehydrogenase [ubiquinone] 1 alpha subcomplex assembly factor 3","Organismal Systems; Environmental adaptation; Thermogenesis | Brite Hierarchies; Protein families: genetic information processing; Mitochondrial biogenesis",-0.486144273745813,0.495910879258349,-0.982055153004161,-1.36226110797089,"Standard"
"487","K09580_protein disulfide-isomerase A1 [EC:5.3.4.1]","K09580","variable:Microbe_treatment",-0.427686758107379,-0.552058248437632,0.892904975258132,"K09580","protein disulfide-isomerase A1 [EC:5.3.4.1]","Genetic Information Processing; Folding, sorting and degradation; Protein processing in endoplasmic reticulum | Brite Hierarchies; Protein families: genetic information processing; Chaperones and folding catalysts | Brite Hierarchies; Protein families: genetic information processing; Membrane trafficking | Brite Hierarchies; Protein families: signaling and cellular processes; Exosome",-0.497492141608783,0.444766467266233,-0.942258608875016,-1.3072135926682,"Standard"
"488","K09692_teichoic acid transport system permease protein","K09692","variable:Microbe_treatment",-0.341849922433191,-0.380322272249682,0.344851348589147,"K09692","teichoic acid transport system permease protein","Environmental Information Processing; Membrane transport; ABC transporters | Brite Hierarchies; Protein families: signaling and cellular processes; Transporters",-0.590875238326411,0.361781630701248,-0.952656869027658,-1.32159671053432,"Standard"
"489","K09693_teichoic acid transport system ATP-binding protein [EC:3.6.3.40]","K09693","variable:Microbe_treatment",-0.310919105270245,-0.443415374835979,0.422394970138385,"K09693","teichoic acid transport system ATP-binding protein [EC:3.6.3.40]","Environmental Information Processing; Membrane transport; ABC transporters | Brite Hierarchies; Protein families: signaling and cellular processes; Transporters",-0.570323196152194,0.36878325835355,-0.939106454505744,-1.30285345864963,"Standard"
"490","K09740_uncharacterized protein","K09740","variable:Microbe_treatment",-0.353094192741766,-0.206792939137867,0.541823741761476,"K09740","uncharacterized protein","Not Included in Pathway or Brite; Poorly characterized; Function unknown",-0.550492324719569,0.539524981539486,-1.09001730625905,-1.51159689612689,"Standard"
"491","K09759_nondiscriminating aspartyl-tRNA synthetase [EC:6.1.1.23]","K09759","variable:Microbe_treatment",-0.799612915289597,0.4110927285564,0.0201907544771995,"K09759","nondiscriminating aspartyl-tRNA synthetase [EC:6.1.1.23]","Genetic Information Processing; Translation; Aminoacyl-tRNA biosynthesis | Brite Hierarchies; Protein families: metabolism; Amino acid related enzymes | Brite Hierarchies; Protein families: genetic information processing; Transfer RNA biogenesis",-0.694976382376562,0.471341989250309,-1.16631837162687,-1.61713832328743,"Standard"
