"","kegg.name","id","grpvar","EMO","MEM","MMO","KO","names","Pathway","Bamboo","Larval food","BvL","sBvL","food_indicator"
"242","K16343_calcium-independent phospholipase A2 [EC:3.1.1.4]","K16343","variable:Microbe_treatment",0.344800417662786,0.0915841502317167,-0.841562975914225,"K16343","calcium-independent phospholipase A2 [EC:3.1.1.4]","Metabolism; Lipid metabolism; Glycerophospholipid metabolism | Metabolism; Lipid metabolism; Ether lipid metabolism | Metabolism; Lipid metabolism; Arachidonic acid metabolism | Metabolism; Lipid metabolism; Linoleic acid metabolism | Metabolism; Lipid metabolism; alpha-Linolenic acid metabolism | Environmental Information Processing; Signal transduction; Ras signaling pathway | Organismal Systems; Circulatory system; Vascular smooth muscle contraction | Organismal Systems; Sensory system; Inflammatory mediator regulation of TRP channels",0.605078937822641,-0.851086504555388,1.45616544237803,2.01034293272419,"Bamboo"
"243","K16385_polyene macrolide polyketide synthase, KS-AT-KR-ACP domains","K16385","variable:Microbe_treatment",-0.0343163257417319,0.0651782546584854,-0.354681599792316,"K16385","polyene macrolide polyketide synthase, KS-AT-KR-ACP domains","Metabolism; Metabolism of terpenoids and polyketides; Type I polyketide structures",0.635755017794352,-0.832364925221646,1.468119943016,2.02687867901083,"Bamboo"
"244","K16566_exopolysaccharide production protein ExoY","K16566","variable:Microbe_treatment",0.184883340438901,0.195323914974484,-0.48420693119415,"K16566","exopolysaccharide production protein ExoY","Not Included in Pathway or Brite; Unclassified: metabolism; Glycan metabolism",0.882247905861807,-0.945392206430201,1.82764011229201,2.52417542808598,"Bamboo"
"245","K16649_rhamnopyranosyl-N-acetylglucosaminyl-diphospho-decaprenol beta-1,3/1,4-galactofuranosyltransferase [EC:2.4.1.287]","K16649","variable:Microbe_treatment",0.564484010608436,0.387210763704146,-1.17216838423883,"K16649","rhamnopyranosyl-N-acetylglucosaminyl-diphospho-decaprenol beta-1,3/1,4-galactofuranosyltransferase [EC:2.4.1.287]","Metabolism; Glycan biosynthesis and metabolism; Arabinogalactan biosynthesis - Mycobacterium | Brite Hierarchies; Protein families: metabolism; Glycosyltransferases",0.652775482110146,-0.786637936854035,1.43941341896418,1.98717114016269,"Bamboo"
"246","K16650_galactofuranosylgalactofuranosylrhamnosyl-N-acetylglucosaminyl-diphospho-decaprenol beta-1,5/1,6-galactofuranosyltransferase [EC:2.4.1.288]","K16650","variable:Microbe_treatment",-0.170310180483589,0.0370608705390317,-0.237842684012508,"K16650","galactofuranosylgalactofuranosylrhamnosyl-N-acetylglucosaminyl-diphospho-decaprenol beta-1,5/1,6-galactofuranosyltransferase [EC:2.4.1.288]","Metabolism; Glycan biosynthesis and metabolism; Arabinogalactan biosynthesis - Mycobacterium | Brite Hierarchies; Protein families: metabolism; Glycosyltransferases",0.517049458808497,-0.742361165109828,1.25941062391832,1.73818704288379,"Bamboo"
"247","K16697_teichuronic acid biosynthesis glycosyltransferase TuaC [EC:2.4.-.-]","K16697","variable:Microbe_treatment",0.406109911671582,0.073567000523414,-0.599094398235394,"K16697","teichuronic acid biosynthesis glycosyltransferase TuaC [EC:2.4.-.-]","Brite Hierarchies; Protein families: metabolism; Glycosyltransferases",0.947742977833502,-1.02024833494204,1.96799131277555,2.71831250771023,"Bamboo"
"248","K16699_teichuronic acid biosynthesis glycosyltransferase TuaH [EC:2.4.-.-]","K16699","variable:Microbe_treatment",-0.773524741538582,0.0985752475126363,0.33148461367729,"K16699","teichuronic acid biosynthesis glycosyltransferase TuaH [EC:2.4.-.-]","Brite Hierarchies; Protein families: metabolism; Glycosyltransferases",0.536098134164028,-0.744635800042348,1.28073393420638,1.76768194690301,"Bamboo"
"249","K16860_phospholipase D3/4 [EC:3.1.4.4]","K16860","variable:Microbe_treatment",0.621093843841916,0.760315595526973,-1.45413047748539,"K16860","phospholipase D3/4 [EC:3.1.4.4]","Metabolism; Lipid metabolism; Glycerophospholipid metabolism | Metabolism; Lipid metabolism; Ether lipid metabolism | Brite Hierarchies; Protein families: genetic information processing; Membrane trafficking",0.630089454883007,-0.674242660688704,1.30433211557171,1.80032350606976,"Bamboo"
"250","K16911_ATP-dependent RNA helicase DDX21 [EC:3.6.4.13]","K16911","variable:Microbe_treatment",0.519017707079193,0.197180703715958,-1.07390597387564,"K16911","ATP-dependent RNA helicase DDX21 [EC:3.6.4.13]","Brite Hierarchies; Protein families: genetic information processing; Ribosome biogenesis | Brite Hierarchies; Protein families: genetic information processing; Chromosome and associated proteins",0.721587963328301,-0.938773196928034,1.66036116025634,2.29279124954724,"Bamboo"
"251","K16963_putative S-methylcysteine transport system ATP-binding protein","K16963","variable:Microbe_treatment",-0.0240332529364825,0.0851042938613015,-0.409370997805043,"K16963","putative S-methylcysteine transport system ATP-binding protein","Environmental Information Processing; Membrane transport; ABC transporters | Brite Hierarchies; Protein families: signaling and cellular processes; Transporters",0.483292971189005,-0.694766295505571,1.17805926669458,1.62565993331525,"Bamboo"
"252","K17202_erythritol transport system substrate-binding protein","K17202","variable:Microbe_treatment",0.203899300487595,0.323683271837013,-0.555629985784087,"K17202","erythritol transport system substrate-binding protein","Environmental Information Processing; Membrane transport; ABC transporters | Brite Hierarchies; Protein families: signaling and cellular processes; Transporters",0.485506207298636,-0.502535436403011,0.988041643701647,1.36282309060997,"Bamboo"
"253","K17203_erythritol transport system permease protein","K17203","variable:Microbe_treatment",0.195955554297981,0.296749743697409,-0.515956485778882,"K17203","erythritol transport system permease protein","Environmental Information Processing; Membrane transport; ABC transporters | Brite Hierarchies; Protein families: signaling and cellular processes; Transporters",0.519085473354368,-0.53320263265271,1.05228810600708,1.45169030745739,"Bamboo"
"254","K17217_cystathionine gamma-lyase / homocysteine desulfhydrase [EC:4.4.1.1 4.4.1.2]","K17217","variable:Microbe_treatment",0.514258699365997,0.242265468966226,-1.05922052277592,"K17217","cystathionine gamma-lyase / homocysteine desulfhydrase [EC:4.4.1.1 4.4.1.2]","Metabolism; Energy metabolism; Sulfur metabolism | Metabolism; Amino acid metabolism; Glycine, serine and threonine metabolism | Metabolism; Amino acid metabolism; Cysteine and methionine metabolism",0.576399335239159,-0.760184038820754,1.33658337405991,1.84493420491335,"Bamboo"
"255","K17224_S-sulfosulfanyl-L-cysteine sulfohydrolase [EC:3.1.6.20]","K17224","variable:Microbe_treatment",0.0641567572475491,0.173913365388319,-0.297859665833927,"K17224","S-sulfosulfanyl-L-cysteine sulfohydrolase [EC:3.1.6.20]","Metabolism; Energy metabolism; Sulfur metabolism",0.561542490150466,-0.597844227229953,1.15938671738042,1.59983162418429,"Bamboo"
"256","K17468_D-glucosaminate-6-phosphate ammonia-lyase [EC:4.3.1.29]","K17468","variable:Microbe_treatment",-0.144631457513016,0.200073093395058,-0.46989740763419,"K17468","D-glucosaminate-6-phosphate ammonia-lyase [EC:4.3.1.29]","Metabolism; Carbohydrate metabolism; Pentose phosphate pathway",0.354706773540503,-0.606347171718201,0.961053945258704,1.32549307174699,"Bamboo"
"257","K17476_pentalenolactone synthase [EC:1.14.19.8]","K17476","variable:Microbe_treatment",0.118344119851712,0.209643249138663,-0.743720254403808,"K17476","pentalenolactone synthase [EC:1.14.19.8]","Metabolism; Biosynthesis of other secondary metabolites; Biosynthesis of secondary metabolites - unclassified | Brite Hierarchies; Protein families: metabolism; Cytochrome P450",0.348885785227727,-0.601301593985147,0.950187379212874,1.31046218216134,"Bamboo"
"258","K17495_CUB and sushi domain-containing protein","K17495","variable:Microbe_treatment",0.372851883535784,0.709018903632673,-1.3473299932755,"K17495","CUB and sushi domain-containing protein","Brite Hierarchies; Protein families: metabolism; Protein phosphatases and associated proteins",1.00148938057979,-1.16266522822767,2.16415460880746,2.98965018982409,"Bamboo"
"259","K17677_ATP-dependent helicase IRC3 [EC:3.6.4.-]","K17677","variable:Microbe_treatment",0.460527879838278,0.512030148989156,-1.05446430268757,"K17677","ATP-dependent helicase IRC3 [EC:3.6.4.-]","Brite Hierarchies; Protein families: genetic information processing; Mitochondrial biogenesis",0.524728846306617,-0.574458947253895,1.09918779356051,1.51656305771207,"Bamboo"
"260","K17756_long-chain-alcohol oxidase [EC:1.1.3.20]","K17756","variable:Microbe_treatment",0.432332406587182,0.155486078626294,-0.859206334131144,"K17756","long-chain-alcohol oxidase [EC:1.1.3.20]","Not Included in Pathway or Brite; Unclassified: metabolism; Enzymes with EC numbers",0.504471883888722,-0.669247358177619,1.17371924206634,1.61965670923223,"Bamboo"
"261","K17763_rsbT co-antagonist protein RsbR","K17763","variable:Microbe_treatment",0.364589409363769,0.0604145815801435,-0.44481556500912,"K17763","rsbT co-antagonist protein RsbR","Brite Hierarchies; Protein families: genetic information processing; Transcription machinery",0.471933843028225,-0.483962611176922,0.955896454205147,1.31835910888899,"Bamboo"
"262","K17817_8-oxo-dGDP phosphatase [EC:3.6.1.58]","K17817","variable:Microbe_treatment",0.592211330413591,0.593351152813941,-1.41524582012086,"K17817","8-oxo-dGDP phosphatase [EC:3.6.1.58]","Brite Hierarchies; Protein families: genetic information processing; DNA repair and recombination proteins",0.673919518321661,-0.813373738264778,1.48729325658644,2.05339965703212,"Bamboo"
"263","K17893_ubiquinol oxidase [EC:1.10.3.11]","K17893","variable:Microbe_treatment",0.336711787971208,0.265350098856632,-0.915975711837551,"K17893","ubiquinol oxidase [EC:1.10.3.11]","Not Included in Pathway or Brite; Unclassified: metabolism; Enzymes with EC numbers",0.635658087438783,-0.826253575070615,1.4619116625094,2.01829123948137,"Bamboo"
"264","K17940_2-heptyl-3-hydroxy-4(1H)-quinolone synthase [EC:1.14.13.182]","K17940","variable:Microbe_treatment",0.125799887932653,0.607376234075582,-0.935364014216792,"K17940","2-heptyl-3-hydroxy-4(1H)-quinolone synthase [EC:1.14.13.182]","Metabolism; Biosynthesis of other secondary metabolites; Phenazine biosynthesis | Cellular Processes; Cellular community - prokaryotes; Quorum sensing | Cellular Processes; Cellular community - prokaryotes; Biofilm formation - Pseudomonas aeruginosa",1.12067980550668,-1.24343992894995,2.36411973445664,3.26624665203091,"Bamboo"
"265","K18063_cephamycin C biosynthesis protein","K18063","variable:Microbe_treatment",0.696179502648812,0.725110851777333,-1.69124393336062,"K18063","cephamycin C biosynthesis protein","Not Included in Pathway or Brite; Unclassified: metabolism; Secondary metabolism",1.15796338846905,-1.32186803336127,2.47983142183032,3.42630177794169,"Bamboo"
"266","K18066_tRNA wybutosine-synthesizing protein 5 [EC:1.14.11.42]","K18066","variable:Microbe_treatment",0.404895265034401,0.359799389832038,-1.09989168410871,"K18066","tRNA wybutosine-synthesizing protein 5 [EC:1.14.11.42]","Brite Hierarchies; Protein families: genetic information processing; Transfer RNA biogenesis",0.480818859123133,-0.684336627858536,1.16515548698167,1.60781112189826,"Bamboo"
"267","K18069_phthalate 4,5-dioxygenase reductase component [EC:1.18.1.-]","K18069","variable:Microbe_treatment",0.361578137393652,0.209223141974756,-0.840994081215337,"K18069","phthalate 4,5-dioxygenase reductase component [EC:1.18.1.-]","Metabolism; Xenobiotics biodegradation and metabolism; Polycyclic aromatic hydrocarbon degradation",1.15566151085473,-1.31971140200251,2.47537291285725,3.42013466352777,"Bamboo"
"268","K18076_1,2-dihydroxy-3,5-cyclohexadiene-1,4-dicarboxylate dehydrogenase [EC:1.3.1.53]","K18076","variable:Microbe_treatment",-0.282500956947625,0.186273333640266,-0.289512353731587,"K18076","1,2-dihydroxy-3,5-cyclohexadiene-1,4-dicarboxylate dehydrogenase [EC:1.3.1.53]","Metabolism; Xenobiotics biodegradation and metabolism; Polycyclic aromatic hydrocarbon degradation",0.474086893624449,-0.708292249252081,1.18237914287653,1.63163528759375,"Bamboo"
"269","K18077_terephthalate 1,2-dioxygenase reductase component [EC:1.18.1.-]","K18077","variable:Microbe_treatment",0.231387084097224,0.14175971316727,-0.741944133997774,"K18077","terephthalate 1,2-dioxygenase reductase component [EC:1.18.1.-]","Metabolism; Xenobiotics biodegradation and metabolism; Polycyclic aromatic hydrocarbon degradation",0.764487019572101,-0.988405504939306,1.75289252451141,2.42078280764035,"Bamboo"
"270","K18129_TetR/AcrR family transcriptional regulator, mexXY operon repressor","K18129","variable:Microbe_treatment",0.472476433690572,0.116638621516838,-0.971824013967578,"K18129","TetR/AcrR family transcriptional regulator, mexXY operon repressor","Human Diseases; Drug resistance: Antimicrobial; beta-Lactam resistance | Brite Hierarchies; Protein families: genetic information processing; Transcription factors | Brite Hierarchies; Protein families: signaling and cellular processes; Antimicrobial resistance genes",0.735997826536523,-0.968362873261396,1.70436069979792,2.35365244690064,"Bamboo"
"271","K18209_fumarate reductase (CoM/CoB) subunit A [EC:1.3.4.1]","K18209","variable:Microbe_treatment",0.112514825956393,0.0693092717127575,-0.512455337189008,"K18209","fumarate reductase (CoM/CoB) subunit A [EC:1.3.4.1]","Metabolism; Energy metabolism; Carbon fixation pathways in prokaryotes",0.928567362960658,-1.12931297306768,2.05788033602834,2.84264911761774,"Bamboo"
"272","K18223_propane 2-monooxygenase large subunit [EC:1.14.13.227]","K18223","variable:Microbe_treatment",0.285645869627008,0.278838157075954,-0.942380795028595,"K18223","propane 2-monooxygenase large subunit [EC:1.14.13.227]","Metabolism; Carbohydrate metabolism; Propanoate metabolism",0.575243609491646,-0.804686893269573,1.37993050276122,1.90489297225681,"Bamboo"
"273","K18224_propane 2-monooxygenase small subunit [EC:1.14.13.227]","K18224","variable:Microbe_treatment",0.320125821379085,0.249252241762631,-0.954693567837097,"K18224","propane 2-monooxygenase small subunit [EC:1.14.13.227]","Metabolism; Carbohydrate metabolism; Propanoate metabolism",0.71683101512925,-0.950778648710695,1.66760966383995,2.30281755008845,"Bamboo"
"274","K18226_propane monooxygenase coupling protein","K18226","variable:Microbe_treatment",0.0801722067690765,0.289175856619109,-0.785489471130313,"K18226","propane monooxygenase coupling protein","Metabolism; Carbohydrate metabolism; Propanoate metabolism",0.550525626494895,-0.803189473109341,1.35371509960424,1.86863121038705,"Bamboo"
"275","K18235_virginiamycin B lyase [EC:4.2.99.-]","K18235","variable:Microbe_treatment",0.352601919971366,0.0605495295067038,-0.724565283745759,"K18235","virginiamycin B lyase [EC:4.2.99.-]","Brite Hierarchies; Protein families: signaling and cellular processes; Antimicrobial resistance genes",0.755828521059675,-0.944906117739951,1.70073463879963,2.34863679409309,"Bamboo"
"276","K18248_anthranilate 1,2-dioxygenase ferredoxin component","K18248","variable:Microbe_treatment",0.374906074586657,0.518600724825336,-1.02297728093072,"K18248","anthranilate 1,2-dioxygenase ferredoxin component","Metabolism; Xenobiotics biodegradation and metabolism; Aminobenzoate degradation",0.619030526248687,-0.697639646309668,1.31667017255835,1.81738979651383,"Bamboo"
"277","K18288_itaconate CoA-transferase [EC:2.8.3.-]","K18288","variable:Microbe_treatment",0.460280077385504,0.324721120849729,-0.911964514255276,"K18288","itaconate CoA-transferase [EC:2.8.3.-]","Metabolism; Carbohydrate metabolism; C5-Branched dibasic acid metabolism",0.889947262979105,-0.96703413587311,1.85698139885221,2.56476098535654,"Bamboo"
"278","K18293_p-cymene methyl-monooxygenase electron transfer component [EC:1.18.1.3]","K18293","variable:Microbe_treatment",-0.128110746484102,0.0581306240694847,-0.128921257496001,"K18293","p-cymene methyl-monooxygenase electron transfer component [EC:1.18.1.3]","Metabolism; Xenobiotics biodegradation and metabolism; Xylene degradation",0.547309543997168,-0.668074233139278,1.21538377713645,1.67728807351373,"Bamboo"
"279","K18307_multidrug efflux pump","K18307","variable:Microbe_treatment",0.907579774621638,0.0567848920141286,-1.12010741518769,"K18307","multidrug efflux pump","Cellular Processes; Cellular community - prokaryotes; Quorum sensing | Brite Hierarchies; Protein families: signaling and cellular processes; Transporters",0.506655158538131,-0.601215712232948,1.10787087077108,1.52857369421538,"Bamboo"
"280","K18534_MPBQ/MSBQ methyltransferase [EC:2.1.1.295]","K18534","variable:Microbe_treatment",0.253959851444117,0.306674832086843,-0.733388437585595,"K18534","MPBQ/MSBQ methyltransferase [EC:2.1.1.295]","Metabolism; Metabolism of cofactors and vitamins; Ubiquinone and other terpenoid-quinone biosynthesis",0.88013361881011,-0.985022551284664,1.86515617009477,2.5760685210966,"Bamboo"
"281","K18565_2-oxoglutarate-dependent dioxygenase [EC:1.14.20.-]","K18565","variable:Microbe_treatment",0.0241648081636846,0.393624016549869,-0.781591142632586,"K18565","2-oxoglutarate-dependent dioxygenase [EC:1.14.20.-]","Metabolism; Biosynthesis of other secondary metabolites; Carbapenem biosynthesis",0.807847589379989,-1.02873330597187,1.83658089535186,2.5365425293777,"Bamboo"
"282","K18613_3-hydroxy-2-methylpyridine-4,5-dicarboxylate 4-decarboxylase [EC:4.1.1.51]","K18613","variable:Microbe_treatment",0.231473976751887,0.381084748167833,-0.824665535851214,"K18613","3-hydroxy-2-methylpyridine-4,5-dicarboxylate 4-decarboxylase [EC:4.1.1.51]","Metabolism; Metabolism of cofactors and vitamins; Vitamin B6 metabolism",0.631068222127912,-0.759850702664633,1.39091892479254,1.92009241590596,"Bamboo"
"283","K18637_axial budding pattern protein 2","K18637","variable:Microbe_treatment",0.0673466377181873,0.544722602919542,-0.97493715440893,"K18637","axial budding pattern protein 2","Brite Hierarchies; Protein families: signaling and cellular processes; Cytoskeleton proteins",0.46092679226825,-0.681245177318759,1.14217196958701,1.57601978038412,"Bamboo"
"284","K18642_crescentin","K18642","variable:Microbe_treatment",0.338817170588776,0.0786332495872715,-0.758955696361246,"K18642","crescentin","Brite Hierarchies; Protein families: signaling and cellular processes; Cytoskeleton proteins",0.398310340337672,-0.605658215638633,1.0039685559763,1.38485357004856,"Bamboo"
"285","K18853_dihydromethanopterin reductase (acceptor) [EC:1.5.99.15]","K18853","variable:Microbe_treatment",0.4305504878686,0.202620714547478,-0.993877087997849,"K18853","dihydromethanopterin reductase (acceptor) [EC:1.5.99.15]","Metabolism; Metabolism of cofactors and vitamins; Folate biosynthesis",0.499907358775316,-0.718913049754369,1.21882040852968,1.68204170283881,"Bamboo"
"286","K18909_MarR family transcriptional regulator, repressor for mepA","K18909","variable:Microbe_treatment",0.347691384149358,0.522445488466245,-1.1929175825639,"K18909","MarR family transcriptional regulator, repressor for mepA","Brite Hierarchies; Protein families: genetic information processing; Transcription factors | Brite Hierarchies; Protein families: signaling and cellular processes; Antimicrobial resistance genes",0.606695108057,-0.802674201392061,1.40936930944906,1.94561342166024,"Bamboo"
"287","K18933_tyrosine decarboxylase / aspartate 1-decarboxylase [EC:4.1.1.25 4.1.1.11]","K18933","variable:Microbe_treatment",0.639788026179598,0.221938828502741,-1.20035346649881,"K18933","tyrosine decarboxylase / aspartate 1-decarboxylase [EC:4.1.1.25 4.1.1.11]","Metabolism; Energy metabolism; Methane metabolism | Metabolism; Amino acid metabolism; Tyrosine metabolism | Metabolism; Metabolism of other amino acids; beta-Alanine metabolism | Metabolism; Metabolism of cofactors and vitamins; Pantothenate and CoA biosynthesis",0.832055147417925,-1.03765521680729,1.86971036422521,2.58236798946935,"Bamboo"
"288","K18989_multidrug efflux pump","K18989","variable:Microbe_treatment",-0.204529704032377,0.0367704481698796,0.122552960696623,"K18989","multidrug efflux pump","Brite Hierarchies; Protein families: signaling and cellular processes; Transporters",1.03557299818178,-1.06302039037899,2.09859338856077,2.89896436888744,"Bamboo"
"289","K18990_membrane fusion protein, multidrug efflux system","K18990","variable:Microbe_treatment",0.60693608307635,0.802852698278465,-1.63575220600741,"K18990","membrane fusion protein, multidrug efflux system","Brite Hierarchies; Protein families: signaling and cellular processes; Transporters",0.935678713909501,-1.07287435703636,2.00855307094586,2.77441848506191,"Bamboo"
"290","K19209_beta-lactamase class D OXA-42 [EC:3.5.2.6]","K19209","variable:Microbe_treatment",-1.07221518059931,0.0441354499253926,0.66512951739319,"K19209","beta-lactamase class D OXA-42 [EC:3.5.2.6]","Human Diseases; Drug resistance: Antimicrobial; beta-Lactam resistance | Brite Hierarchies; Protein families: signaling and cellular processes; Antimicrobial resistance genes",0.822104519622776,-1.04247287353066,1.86457739315343,2.57526794322652,"Bamboo"
"291","K19272_aminoglycoside 3'-phosphotransferase I [EC:2.7.1.95]","K19272","variable:Microbe_treatment",0.260151067461818,0.240278520218169,-0.846286423682817,"K19272","aminoglycoside 3'-phosphotransferase I [EC:2.7.1.95]","Brite Hierarchies; Protein families: signaling and cellular processes; Antimicrobial resistance genes",0.70380130291932,-0.913791265313371,1.61759256823269,2.23363272773549,"Bamboo"
"292","K19423_glycosyltransferase EpsE [EC:2.4.-.-]","K19423","variable:Microbe_treatment",0.317504829271701,0.414804967013451,-0.72068949335727,"K19423","glycosyltransferase EpsE [EC:2.4.-.-]","Brite Hierarchies; Protein families: metabolism; Glycosyltransferases",0.833209173199271,-0.826153806004466,1.65936297920374,2.2914105420519,"Bamboo"
"293","K19424_glycosyltransferase EpsF [EC:2.4.-.-]","K19424","variable:Microbe_treatment",0.762410629588772,0.0596594335888495,-1.04410587363213,"K19424","glycosyltransferase EpsF [EC:2.4.-.-]","Brite Hierarchies; Protein families: metabolism; Glycosyltransferases",0.610307302798835,-0.745118261073761,1.3554255638726,1.87099716476946,"Bamboo"
"294","K19509_PTS system, fructoselysine/glucoselysine-specific IID component","K19509","variable:Microbe_treatment",0.461848266067533,0.292929790071463,-1.06779964238368,"K19509","PTS system, fructoselysine/glucoselysine-specific IID component","Environmental Information Processing; Membrane transport; Phosphotransferase system (PTS) | Brite Hierarchies; Protein families: signaling and cellular processes; Transporters",0.900371951426459,-1.09042570859294,1.9907976600194,2.74985878330718,"Bamboo"
"295","K19511_peroxidase [EC:1.11.1.7]","K19511","variable:Microbe_treatment",0.335590003059697,0.0138560481604038,-0.644711764813324,"K19511","peroxidase [EC:1.11.1.7]","Not Included in Pathway or Brite; Unclassified: metabolism; Enzymes with EC numbers",0.845469702434524,-1.0247428283044,1.87021253073893,2.58306259799512,"Bamboo"
"296","K19586_membrane fusion protein, multidrug efflux system","K19586","variable:Microbe_treatment",0.281098573017981,0.286641287189728,-0.600772518970848,"K19586","membrane fusion protein, multidrug efflux system","Brite Hierarchies; Protein families: signaling and cellular processes; Transporters",0.580220947226598,-0.600277011035007,1.18049795826161,1.62903318881499,"Bamboo"
"297","K19592_MerR family transcriptional regulator, gold-responsive activator of gol and ges genes","K19592","variable:Microbe_treatment",0.213093111711171,0.319984823249279,-0.655394957353525,"K19592","MerR family transcriptional regulator, gold-responsive activator of gol and ges genes","Brite Hierarchies; Protein families: genetic information processing; Transcription factors",0.535005034934343,-0.609270870559647,1.14427590549399,1.57892999398607,"Bamboo"
"298","K19593_outer membrane protein, multidrug efflux system","K19593","variable:Microbe_treatment",0.0131824956804032,0.175961927538159,-0.481495486947062,"K19593","outer membrane protein, multidrug efflux system","Brite Hierarchies; Protein families: signaling and cellular processes; Transporters | Brite Hierarchies; Protein families: signaling and cellular processes; Antimicrobial resistance genes",0.491058993269116,-0.668562464322977,1.15962145759209,1.60015632236291,"Bamboo"
"299","K19597_Au+-exporting ATPase [EC:3.6.1.-]","K19597","variable:Microbe_treatment",0.413336164722052,0.453556587549048,-0.922252076090243,"K19597","Au+-exporting ATPase [EC:3.6.1.-]","Not Included in Pathway or Brite; Unclassified: metabolism; Enzymes with EC numbers",1.10852359598849,-1.1421354871435,2.25065908313199,3.10930521209634,"Bamboo"
"300","K19613_leucine-rich repeat protein SHOC2","K19613","variable:Microbe_treatment",0.551491712390186,0.295917674089377,-1.18684624948089,"K19613","leucine-rich repeat protein SHOC2","Environmental Information Processing; Signal transduction; Ras signaling pathway",0.806807341976504,-1.01289936236444,1.81970670434094,2.51320175172425,"Bamboo"
"301","K19620_extracellular factor (EF) 3-hydroxypalmitic acid methyl ester biosynthesis protein","K19620","variable:Microbe_treatment",0.495833282669216,0.575111932536652,-1.27146920437953,"K19620","extracellular factor (EF) 3-hydroxypalmitic acid methyl ester biosynthesis protein","Environmental Information Processing; Signal transduction; Two-component system",1.17679765397467,-1.29854752433241,2.47534517830708,3.42009630044606,"Bamboo"
